{
  "$schema": "../schemas/config.schema.json",
  "name": "codex",
  "_source": { "type": "url" },
  "files": {
    "using-codex": {
      "cli": {
        "overview": "https://developers.openai.com/codex/cli.md",
        "features": "https://developers.openai.com/codex/cli/features.md",
        "command-line-options": "https://developers.openai.com/codex/cli/reference.md",
        "slash-commands": "https://developers.openai.com/codex/cli/slash-commands.md"
      }
    },
    "configuration": {
      "config-file": {
        "basic-configuration": "https://developers.openai.com/codex/config-basic.md",
        "advanced-configuration": "https://developers.openai.com/codex/cli/config-advanced.md",
        "configuration-reference": "https://developers.openai.com/codex/cli/config-reference.md",
        "sample-configuration": "https://developers.openai.com/codex/config-sample.md"
      },
      "rules": "https://developers.openai.com/codex/rules.md",
      "agents-md": "https://developers.openai.com/codex/guides/agents-md.md",
      "custom-prompts": "https://developers.openai.com/codex/custom-prompts.md",
      "mcp": "https://developers.openai.com/codex/mcp.md",
      "skills": {
        "overview": "https://developers.openai.com/codex/skills.md",
        "create-skill": "https://developers.openai.com/codex/skills/create-skill.md"
      }
    }
  },
  "versions": {}
}
