{
  "$schema": "../schemas/config.schema.json",
  "name": "antigravity",
  "_source": {
    "type": "url",
    "convert": "html",
    "_disabled": true,
    "_reason": "SPA site - requires Playwright handler (not yet implemented)"
  },
  "files": {
    "home": {
      "getting-started": "https://antigravity.google/docs/get-started"
    },
    "agent": {
      "models": "https://antigravity.google/docs/models",
      "agent-modes-settings": "https://antigravity.google/docs/agent-modes-settings",
      "rules-workflows": "https://antigravity.google/docs/rules-workflows",
      "skills": "https://antigravity.google/docs/skills",
      "task-groups": "https://antigravity.google/docs/task-groups",
      "browser-subagent": "https://antigravity.google/docs/browser-subagent",
      "secure-mode": "https://antigravity.google/docs/secure-mode"
    },
    "tools": {
      "mcp": "https://antigravity.google/docs/mcp"
    }
  },
  "versions": {}
}
